post,bully
Describe the perfect guy I have him My Timmy r He s super in everyway possible Sweet and sensitive enough to understand but hard and can stand his ground when it comes down to it A little over protective but only enough to show that he truly cares He brings flowers home for me being his girlfriend day If I want anything he d get it but knows I have everything I want Compassionate and caring and loves everything that I do He enjoys all the same foods as I do and is open to exploring new boundaries he s never expierenced Ohh and He let s me be crazy about things that Im so passionate about that most guys would laugh at and make fun of Recycling planting flowers and smiling at people just because I want to make their day He s perfect for me He understands me in every aspect a man could Hes sweet enough to damper my attitude and sarcasm at times but bullheaded enough to not always give in to me Lets me whine if I want attention and holds me more than I could ever want to be held I love him And for me hes my perfet guy 3r Ohh and he s a super sexxy stud of course,0
Describe your first REAL date HMM REAL I guess it was in 8th grade my first date movie date with another guy and two other couples haha if that s what you call 8th graders dating Anyway we all went to see a movie i dont remember what the movie was but it was all awkwardness and trying to be older than we were I remember keeping my hand still for the entire movie while he held it and my hand was numb tingling and was trying to go to sleep the entire time It was rediculous thinking about it now hahahha,0
describe your perfect day Sunshine Lots of food and hanging with my boyfriend and family r Awesomeness,0
describe yourself in 3 words right now hungry sick tired r always happy selfless trusting,0
Describe yourself in a single sentence I m a blunt and funny dancing alien that doesn t care what anyone thinks and loves to have fun,0
did he ever smell ur feet he has actually and i thought if we were ggoing to keep conversating you would reveal your anonymousness you know you asked buncha ppl bout their feet lol,0
did timmy have fun He says he did haha,0
Did watch heroes Who was your favorite character What was your favorite power robin in batman i thought robin was the best and thought he should be the star hahah and my favorite power was hmm well i guess spidermans powers he is sick haha,0
did you quot celebrate quot 4 20 r lol Nopee Its been a while actually lol,0
Did you believe in the tooth fairy yeshh,0
Did you do any school shopping yet No school for me,0
Did you ever get in trouble for talking in class sometimes,0
Did you ever go to a summer camp church camp once it was fun but we got kicked out,0
Did you ever have a crush you never acted on yes,0
Did you ever have a embarrassing moment at school not really,0
Did you ever play duck duck goose as a child yes of course,0
did you get all my questions cause I   ve been flooding you for the past few days Yes and Yes hahah Ive been answering questions forever and still have like 450 questions I feel like im never going to get through them all Im trying though Sorry I hadn t gotten on here for a couple weeks Big mistake I have like two other spammers that killed my inbox so im still trying to catch up,0
Did you have a good day yes i did,0
did you have fun this weekend MOst dEfinAntly 3,0
did you help someone today Not today I havent even been out of the house haha,0
did you know gaga was on an episode of mtvs boiling point no i didn t actually,0
Did you know gullible was written on the ceiling haha does that really work on people i am gullible at times but really,0
Did you make fun of people in school Not at all,0
did you remember to get those rings and earrings off my dresser Yes ma am thank you lady,0
Did you still want the same job you did when you were a kid yes,0
Did you talk to someone until you fell asleep last night Nope,0
did you wink at all today to who nope but i wink at timmy sometimes,0
Did do you listen to your parents I had to listen to my parents Not listening wasn t an option but once I got older and moved out now i take their advice with a grain of salt and do what i want,0
Do any of your close friends have children My best friend is married to a guy that has a little 2 year old girl,0
Do any of your friends have children yes,0
Do any of your friends have children yes they do,0
do cats have psychic powers to control babys minds and tell them to take over the bahamas and control the worlds supply of milk Hmmm perhaps,0
Do certain peoples lives have certain worth to you Such as a prostiture a killers ect well rapists i think deserve what they do its a touchy subject,0
do humming birds hum because they dont know the words yes they love to buzz,0
Do more people know u by a nickname or by your first name first,0
do people in australia call the rest of the world up over idk,0
Do peoples words bother you sometimes when theyre trying to be gangsta or ignorant,0
Do strangers try to talk to you too One old drunk dude just struck up a convo with Xen at the store yes and its a little creepy,0
Do the Alphabet song and Twinkle Twinkle Little Star have the same tune Yes i believe so,0
do the makers of Friendster uses Facebook i have no idea hahaha,0
do wear Vans the shoes No but not because I don t like them I just think their overated I have a pair of shoestringless nike that I rock their sweet cause they loook like gym shoes but their slip on and offs lovee em,0
do you play an instrument i can play a little guitar and learning the violin,0
do you also like diary of a wimpy kid haha my brother does I think its funny,0
do you always trust your instinct usually,0
do you always wear your watch I never wear a watch i dont like time,0
Do you and Timmy have a KI pass D Not yet Sure hope so here soon D,0
Do you answer phone calls when you don   t know the number NOpE,0
Do you ask questions that sometimes you really don   t want the answer too no,0
Do you believe honesty is the best policy yes for most,0
Do you believe in aliens Yes I do,0
Do you believe in angels and demons yes i think so,0
Do you believe in fate No Only because if it were up to fate then noone truly has any choices in life And well i don t like to be told what to do I like making my own mind up,0
Do you believe in Karma and Destiny Karma YES Destiny NO,0
Do you believe in love I like to think so,0
Do you believe in the quote quot I   ll sleep when im dead     I guess so,0
Do you believe sometimes in life you have to be selfish no,0
Do you believe that everything happens for a reason Perhaps not a reason but a purpose yes,0
Do you believe that God has a gender no,0
Do you believe that the guy should pay on the first date Yes,0
Do you bite your lip a lot nope not really do you,0
Do you bite your lip a lot Not really,0
do you buy things online not too often,0
Do you chew on your pens or pencils No hate that,0
Do you close your eyes when you sneeze i dont think so,0
Do you conform or make your own path make my own path always i like the untaken path,0
Do you consider yourself an animal lover Not really but I do like animals Just not to make love to them ha,0
Do you consider yourself creative yes D,0
Do you crack your knuckles used to don t anymore,0
Do you cry often or keep it inside keep it inside almost always,0
Do you cry often or keep it inside keep it inside always,0
do you cuss Sometimes I do Its usually when I stub my toe or are talking really passionately about something when Im mad or irrated I think its really more a way to make yourself look unintelligent Most people that do often or like in every sentence just don t have anything better to say haha just my opinion,0
Do you dance in the shower nope,0
Do you dance in the shower Not in the shower but i do in the stand up tanning beds hahahha,0
Do you daydream sometimes What do you often daydream about Yes and its never things I can remember I just daze off lol,0
Do you de label your beer bottles nahh,0
Do you do what needs to be done regardless of the consequences yes,0
Do you do your own dishes have to,0
Do you dream in color sometimes,0
Do you eat a lot Lots show your face,0
Do you eat all the servings in the food groups on a daily basis most of the time,0
Do you eat any weird mixture of foods yes,0
Do you eat breakfast daily i try to,0
Do you eat cheeseburgers not really,0
Do you eat jello when you are sick Yes I have actually,0
Do you enjoy giving hugs no but i should more often im sure,0
Do you enjoy going shopping If so what type of things do you enjoy buying yes but i dont much anymore things for others is most fun,0
Do you ever count your steps when you walk Any time i think about doin that i forget im counting and then by the time i get to the end im like dang it haha,0
Do you ever go bird watching I do bird watch actually,0
Do you ever take medication to help you fall asleep faster nope,0
Do you ever think humans will be satisfied N E V E R,0
do you ever think of an amazing song from the 80s or 90s or something and wonder if it would still be big if it was released now for the first time Yes And im sure there are tons that soo could,0
Do you ever think of becoming a model yes,0
Do you ever think of crazy things in you   re head that probably wont happen Yes all the time,0
Do you ever think you smile too little not at all I smile too much,0
Do you ever try to impose your beliefs on others Not really only for conversation,0
Do you ever watch soap operas used to with my ma general hospital is the shiz,0
Do you excercise regularly If so how often no i should but i do yoga a bit so twice a week,0
Do you fall asleep during the day and cannot sleep at night sometimes i did that a lot when i was sick this past wk,0
Do you fall for Internet advertisements show your face,0
Do you fear or respect the law more why do you say that Fear Only because of the corruptness of it all,0
Do you fear something you honestly have no reason to fear I dont think so,0
Do you feel that children should be sheltered from unhappiness nop e,0
Do you feel under appreciated yes,0
Do you feel weird being around people you do not know not really I like meeting new people,0
Do you find the opposite sex confusing Yes very sometimes,0
Do you generally believe people when they telly ou sorry Or do you question it No Usually question it cause most people that say sorry are only saying it its a word it mearly has no meaning and therefore to me seizes existence,0
Do you get along better with the same or opposite sex opposite,0
Do you get along with argumentative people not really being that i am one as well,0
Do you get annoyed when other people display bad manners yeeah,0
Do you get annoyed when someone cuts in front of you when you are waiting in line Yes,0
Do you get cold sores often Nope Show your face why dont you,0
Do you get distracted easily very much so,0
Do you get excited over cameras I love cameras Show your face yooo,0
Do you get mad when people lie to you If I care about the person lying to me,0
Do you get nervous before doctor appointments nope,0
Do you get nervous when alot of people look at you not at all look away haha,0
Do you get upset easily not too easy,0
Do you give it up easy As in sex wise Or do you play hard to get it No Im with my first and am gladly in love with him r HARD TO GET is always BETTER,0
Do you give out second chances too easily Wayyyy tooooo easilyyyyyyy,0
Do you give smart ass answers to questiosn or answer them with a good answer depends on the question really but both,0
do you go buy your first name or by your middle name First,0
do you go to church regularly Not currently Used to,0
Do you guys like robot chicken i do asked idk,0
Do you hate being alone Home alone yes,0
Do you hate the last guy girl you were talking to Nahh hates a strong word,0
Do you have a calendar from 2001 hanging in your room no haha Show YOUR FAce,0
Do you have a calender in your room nope,0
Do you have a cellphone or iPod with a patterened cover no,0
Do you have a distinct smell i think everyone does,0
Do you have a favorite Beatles song Hmm I love the beatles,0
Do you have a favorite Jim Carrey movie He s not really one of my favorites But i likes MASK,0
Do you have a fetish not really,0
do you have a pair of underwear that consistently gives you a wedgie yet you still wear them Only thongs And honestly I never understood why women wear them because they are literally the most uncomfortable things to wear I feel like my asscheeks have no underwire like a bra haha its hard to explain r But now I wear them because they make me feel sexy So if Im in a spicy mood I wear them,0
Do you have a secret that no one knows but you doesnt everyone,0
Do you have a song stuck in your head right now Janet son of a gun haha,0
Do you have a specific work out routine if not how do you keep in shape mentally and physically speaking I do yoga,0
Do you have a T V in your bedroom Nope,0
Do you have a tan I could have a better one,0
Do you have a tattoo where is it located and what does it stand for No nowhere and nothing haha,0
Do you have a twitching problem No haha show your face,0
Do you have A D D not clinically but i think so sometiems hahhahha,0
Do you have an innie or an outtie innie,0
Do you have any concerns at this moment Nahhh only that the occean is dispicably turning to oil at the rate of people saying ohh who really cares and the welfare of the creatures living in it is in our hands not too much of a concern thooough,0
do you have any fun summer plans Not really I wanna go back to gatliburg i gotta necklace from one of the gem places up in the mountians and the head on the necklace broke so i wanna get it fixed haha but other than that the beach would be nice but were tyring to get a house around here so idk if money will work,0
Do you have any health problems Not that im aware of thankfully,0
Do you have any jewelery on a hemp bracelet my sister made me on my left wrist and my two favorite rings r Earrings too lets count 8 others,0
Do you have any magazine subscriptions Nope,0
Do you have any phobias If so what are they Not really that i can think of,0
Do you have any tattoos If not any plans to get one nope and i wanted one but now idk cause i just dont think id be happy in a few years so oh well ill prolly never get any but i like it that way,0
Do you have any weird habits I like to brush my teeth in the shower,0
do you have classes what   s your favorite subject Not currently Im on a waiting list and I really enjoyed microbiology,0
Do you have dreams about becoming famous nahhh,0
Do you have one or more Britney Spears C D All three babay,0
do you have twitter NOpe I used to but then i deleted it because i liked formspring more and didn t have many followers on it,0
Do you have two formsprings me Because I   m following a different account and it   s still you Haha Yeah i made my first one and forgot the password to it haha so i had to make a new one it sucked but at least it was farely new to me teaachgee is the right one,0
Do you have your own bank account mes they can be fun,0
Do you have your own vehicle yes Silver sunfire 2000,0
do you have your twitter account I did And then realized I dont get on my account enough to follow a bazillion people and keep them all posted up on my life So I deleted it r So Im sticking with formspring,0
Do you ignore people when you   re mad upset with them I like to walk away from a situation yes before it escalades and things are said and felt that aren t needed,0
Do you judge people on what they look like Negative I think we as humans all tend to sometimes but its all in unintentional purpose So I try not too,0
Do you know a alcoholic nahh,0
Do you know a drug addict yes,0
Do you know any mechanical stuff about cars I know how to change a tire change my oil what most parts of the car and motor is I can put all liquids in my motor and I soo have my own jumpers haha,0
Do you know anyone in prison Lil wayne,0
Do you know anyone who has broken their thigh bone Did you know the thigh bone is stronger then concrete No I don t know anyone and yes I did know that,0
Do you know anyone who keeps their dog in their house yes tims dad,0
Do you know anyone who was adopted as a child Not to my knowledge,0
Do you know anyone with a mental problem yes many people i work with alot of the mentally handicapped,0
Do you know April She s my sister,0
Do you know how much a peso would be worth in the United States today,0
Do you know how to change a tire Change oil Change a spark plug Yes yes and i have the idea of it as long as i have the paper thatt tells me which numbered spark plug goes where i could do it,0
Do you know how to knit yes,0
Do you know how to play poker i wish i did,0
do you know how to speak korean Nope I know a little thai and some spanish haha go figure Im seriously the whitest korean chick you d ever meet,0
Do you know karate i wish hhhhhighhhhyeaaaahhhh,0
Do you know what boricua moricua morena mean no,0
Do you know what dog treats taste like nope but i can imagine,0
Do you know where your Dad was born ohio,0
Do you learn the easy way or the hard way hard seems like with everything ughh ha,0
Do you leave voice messages yes happy ones but not to my bf because he wont check them so he doesnt get the pleasure of recieving funny and nice and amazing messages from me Mostly just to my sister and back,0
Do you like Alice in Wonderland Not really the second one so much It had some good underlying morals and all but the movie itself drug on and on i thought,0
Do you like beef jerky LOVE IT,0
Do you like blue cheese only in burgers,0
Do you like broccoli L O V E broccoli cheesey broccoli hahaha,0
Do you like candy necklaces They re okay i haven t seen them in a long time,0
Do you like Care Bears NO,0
Do you like carrots Yeshhh,0
do you like cats Nope Not a cat person,0
do you like dogs do you have one I love doggies and not right now at my parents i do if that still counts when you no longer live with them but yes they are bull mastiffs pure bred akc registered sweet looking dogs haha,0
Do you like hot or cold showers hot but sometimes i like cold depends on the mood i guess,0
Do you like hugging people when you meet them or are you uncomfortable doing this not really when i first meet them,0
Do you like it when people just randomly come over yes,0
Do you like ketchup but hate tomatoes nope i love tomatoes,0
Do you like ketchup Love it,0
Do you like Kool Aid not fruit punch blahhh,0
do you like lady gaga Papapapapa shore do haha r I like any thing i can do the robot to haha,0
Do you like mustard love it,0
Do you like nachos Love them i love cheese,0
do you like politics Do I like them No Do I think they have a big part in society yes So I take part in them In america the government is the people So why do people say they hate politics r It can make a great conversation sometimes lol,0
Do you like predictive text yes i do haha,0
do you like riding the roller coaster I love roller coasters,0
Do you like shopping for new clothes Love it but I don t it too much currently,0
do you like skittles LOVE THEM,0
Do you like the movie Chronicles of Narnia Yes Love the creativity,0
Do you like the smell of cigarettes Noooo,0
Do you like the smell of weed yes I think it should be made into a cologne,0
do you like the sound of the wind chimes yes I do its calming haha,0
Do you like this dress I ordered earlier http www topshop com webapp wcs stores servlet ProductDisplay beginIndex 20 amp viewAllFlag false amp catalogId 19551 amp storeId 12556 amp categoryId 160952 amp parent category rn 42344 amp productId 1762331 amp langId 1 prettttty,0
Do you like to go out in the rain Rain doesn t bother me at all other than when Im dressed up and have to be somewhere important Rain is important,0
Do you like to touch sharp objects No show your face,0
Do you like to travel by airplane never been on a plane,0
Do you like Tom Cruise movies like his movies dont like him,0
Do you like traveling How often do you think you ride in a car yes i dont much now but i like to travel,0
Do you like Vitamin Water No Its not as good for you as quot they quot say Water is best for me,0
Do you like wild parties with lots of people somet,0
Do you like your living arrangement not really,0
Do you like your name yep,0
do you like your name Yes i suppose,0
Do you likee chicks Like like women No Like baby chickens yess,0
Do you listen to christian rock sometimes i do,0
Do you listen to music depending on what mood you are in or does music make your mood Okay so i copied and pasted for you and yes to both questions r r Everything seriously r But when im sad Ah me by griffen house I love ADTR amp Emarosa any time of the day anything I can do the robot to and Emmure when Im feeling thrashin ha Ohh and i like instrumental music Underoaths cd of violins is my all time favorite 3,0
Do you listen to music every day Yes i do,0
do you listen to your mom sometimes i like her opinion,0
Do you live in China Nope Ohio,0
Do you loan people money too much sometimes,0
Do you look for quality or quantity qualtily of course,0
Do you look forward to sleeping Only if i ve had a bad day,0
Do you love to party Nahh,0
Do you make the jokes or laugh at them both but usuallly make them,0
Do you make your bed daily nope,0
Do you miss your past I miss being a kid yes,0
Do you miss your past I miss being a kid Yes,0
do you missed formspring I did but now im overwelmed with questions hahah thanks to you,0
Do you over think or under think over think on whats not needed and i seem to underthink on what needs the most thinking,0
Do you own a bathrobe No,0
Do you own a graphing calculator yes when i was in hs,0
Do you own a gun Or would you ever Why No I dont My bf does and yes if i could or had the extra money too have one i would i d like to take a gun class as well just to shoot one r Because you never know when you ll need to defend yourself zombies are cruel hahaa and there s a buncha crazies out there ya just never know and being prepared isn t half bad anymore,0
Do you own a pair of dice noo,0
Do you own a striped sweater i may,0
Do you own any band tu2013shirts yes emery emarosa all the day holiday,0
Do you own any game consoles Nope I like games but i dont own any of my own Usually don t have time for them,0
Do you own anything leopard print a thong,0
Do you own anything that involves with Betty boop No lol thats funny,0
Do you own shirts with funny sayings on them If so which is your favorite not really,0
Do you own slippers nope,0
Do you pay attention to calories on the back of packages not really,0
Do you prefer Chinese or Mexican MMMMHHHMMM i love chinese and mexican haha,0
Do you prefer hot coffee iced coffee or neither Hot coffee iced coffee haha,0
Do you prefer regular or chocolate milk neither im not a milk fan,0
Do you prefer Scary movies or comedy movies comedy,0
Do you prefer tape or a stapler tape duck tape,0
Do you prefer to ask question or answer them why do you think this is both,0
Do you prefer to be blissfully unaware Or know what going on though it may hurt to know know whats going on because then it was MY CHOICE to be hurt,0
Do you prefer to work independently or on a team independently,0
Do you put anything on your spaghetti Bolognaise I dk what spaghetti bolognaise is haha enlighten me,0
Do you put cheese on your spaghetti yes i love cheese,0
do you put on make up everyday Not everyday Usually when I wanna pretty or im going out for something special,0
Do you put up Christmas lights at Christmas time Yes i love decorating,0
Do you randomly bust out singing when you hear a song playing somewhere not too often unless im in the car,0
Do you read trashy romance novels often nope,0
Do you really truly miss someone right now Not really,0
Do you really care what people think about you If so why Nahh because If i cared what others thought about me i would never get to think about what i care about Caring about what others think is a waste of all time in my opinion Its my life Ill live it the way I want,0
Do you recycle yes everyone should RECYCLE,0
Do you regularly watch the news no but i get online a lot,0
Do you say I Love You to your friends all the time every now and then,0
Do you scream on rollercoasters have too it makes it so much more fun,0
Do you shower in the morning or at night before bed at night i like to climb into bed clean,0
Do you shower in the morning or at night before bed repeat,0
Do you shrug it off or cry for hours Shrug it off haha no time to deal with petty bullshiz,0
Do you sing in the car A L W A Y S,0
Do you sleep with noise or in complete silence complete silence and all darkness,0
Do you sleep with your closet doors open or closed Closed usually,0
Do you snore or Steal the covers or Roll around in your sleep I snore sometimes so im told and nahh i lay pretty still when it comes to sleep I sleep like a log ha,0
do you sometimes ask God why things happen to you Nahhh Things always have a purpose,0
do you still believe to the race concept like asian black and white are different type of races or you prefer to use the term ethnic group I don t really think much about it honestly race ethnicity differences color its all the same meaning to me we re all different,0
Do you swear when youu2019re mad Nope,0
Do you take a lot of pictures lots and lots,0
Do you take any dare Dare me,0
Do you take life too seriously or not serious enough i think serious enough,0
Do you take work home with you No,0
Do you take your daily vitamins yes,0
do you talk more i like to talk yes,0
Do you tell a person if you see they have toilet paper stuck on their shoe Yes Wouldn t you hahahhaha,0
