post,bully
If you had to give up one favorite food what would the most difficult Chocolate,0
If you had to perform at the circus what trick would you do Read between these three fingas haha,0
If you had your own talk show who would your first three guests be Justin Bieber Demi lovato and Barack Obama babay D,0
If you won a 1 000 shopping spree for any store which store would you pick Apple store Need a MAC pro,0
If you won a million dollars what would you do with it Great question Tithe Help people Shop,0
If your house was on fire and you could only grab three things what would they be Laptop Dogs Family Shoes bed clothes coffee maker oven washer amp dryer refridgerator table amp chairs pics camera bath tub HAHAhAHAHAHHAHA,0
iLove your nose ring Awhh i love ur earrings,0
ilovee youuu bestfranhdd haa guesss whooo ilovee maryyy rosseeee hickkksss LOL,0
ily ily2 boo,0
Im good Juz got bak from the srip in vegas It was awesome I luved it Hav u evah been to vegas Awhh Yuh so lucky ghurr I bet yuh had a BLAST amp nahh ive never been bhut i would soo want to go D,0
Is TruAce single YESSSSSSSSSSSSSSSSSSSSSSSSSSSSSSSSSSSSSSSSSSSSSSSSSSSSSSSSSSSSSSSSSSSSSSSSSSSSSSSSSSSSSSSSSSSSSSSSSSSSSSSSSSSSSSSSSSSSSSSSSSSSSSS 4 theee lasttt timeee Ask him http www formspring me TRUACE,0
justin bieber is my driving teacher oohh yess bahah we gonna be doing sumthing else instead of him teaching me how to drive lmao HAHAHAHA TEACHIN HIM how to ur his stickshift Mwhahahahahaha i llalala love you best frann,0
lol oo no guurrrl u must be crazy b c i love u muchoo Uhhh lmao U got me lmao jkjk we can go on 4 like eva Lezzzdoooittt I Love you more than yo own momma AHHA,0
Love you baby Love you More babe 3,0
love youu sexy thang Mwahaha Thank yuh meh sexy bitch who is this haha,0
Mammaasss D how are you haha go to skype D YOOOOOOOOOOOOOO Its Late haha i have church tmrw bhut soon kay srry,0
Miley amp Bieber Miley s a HOOCHIE BIEBER ALL THEE WAY GHURL or boy 33,0
NOPE IM NOT BIANCA EITHER heres a clue i come from new zealand LOL Chrisssy hahahahah Chantelle Alesha Kailee Tori LMFAO iddkkkkk,0
NOPEEE my name starts with b O OMFG nooo wayyyy Ughhh BROOOKKKEEEEE OMFG im soo srry lmao lots of pplz r frmh ZEW ZEALAND lmao I fukkinnn luvv yuhhhh hahaha,0
OH VISIT ME IF YOU TRAVEL THE WORLD KTHXBYE xx Hahah Helllz yess I will mamas 3 love u,0
Omg Justin Bieber haha OMG ahhhh Where he go Damn it he just fell off my window sil haha jk,0
Rate yurself I Love Justin Bieber He s a 1000000000 on a 1 10 scale HA,0
shut up ur prettty ll Shut up your prettier 33,0
Sneakers or sandals Sandals 4suree D i wear them in thee winter 2 No lie haha,0
Sooooooo srry this is late im juzz doin mothur freakin boring zzzzzz zzzz snore snore LMBO Hhahahahaah ohh noo problem mamas ahah me2 im soo exhaustedd yawn ywan LMAO,0
the girl on your background bottom right hand corner looks like anna maria perez de tagle Aww Yeahh she is my best friend raphaela Haha She is german so i guess thts why lmao 3,0
tht woul b so cool if u were here so i can me u Ikrr that wud be awesome I wish D,0
wat state do u live in Texas amp Yuh hun xox,0
Well dats so tight ur friends wit truace How does it feel 2 kno him Since ur his friend u wud kno does he hav a gf Ohhkayy First offf i was playin i mean he is a really nice person dnt kno him like all that Bhut u should ask him,0
well u say any language so coba tebak ini bahasa apa kamu ngerti ngga aku ngomong apa Huh That doesnt make sense Guns something lmao Come again lol,0
What are you most excited about right now Ummm SUMMER bein almost here Who isnt haha,0
What did you dream about last night Shh Dnt tell any1 k haha NOTHING MWAH,0
what do u guys prefer Jonas brothers or justin bieber Ahhh I love em both but I would go for Justin Bieber Well because i m older But I perfer them BOTH,0
What do you think about formspring me so far Its da shit Fun stuff,0
What do you think is your most attractive feature My eyes They are light brown and beautidul in the sun Thanks God oh and my hands and ass lol jkjK,0
What do you think was the greatest invention in your lifetime Thee comp or cellfonne hehe,0
What kind of glasses do you have Guess haha no its the brand name,0
What kind of music can you just not stand to listen to I cannot listen to that Heavy metal I like me some rock oldies bhut not that scary shit D,0
What music are you listening to today Everything really AHhaha Lovin my HipHop atm Ester Dean is thee shyyttt,0
What one thing are you exceptionally good at Urgh this is difficult to answer haha Umm prob fixing computers ha yes i said it im like a WIZ at fixin comps that MYSELF and MOM destroy AHAHA,0
What TV show do you wish would go off the air for good The Hills Chuz Lauren was thee whole point it was clld thee Hills and there is 2much drama Bhut I still wtch it chuz i love 2 laugh at thee dumb shit Spencer is a prick btw 0,0
What was the best concert you went to Jonas Brothers Concert 8 13 09 D I still love em bhut Justin bieber is thee shit,0
What was the happiest moment in your life I have many 2many actually bhut i guess when i found my lifetime friends D,0
What was the last book you read The Miracle Worker,0
What was the worst advice you   ve ever received This person actually told me this quot fried quot i had was not a true friend and she wants me 2 still be this person s friend Thats a NONO,0
What was the worst concert you went to Never been 2 1 tht was bad,0
What was the worst job you   ve ever had I can t complain chuz i dnt have or had one hahaha soon though real soon,0
What was the worst place you   ve traveled to Georgia Columbus 2 b exact I Dislike it BORING Hotlanta is where its AT,0
What was your favorite birthday gift Life haha umm idk thats hard,0
What was your favorite year 1995 haha when i was bornwas my year Doh I didnt have 2 do ANYTHING on my own haha,0
What was your worst travel experience HA goin to georgia just to see my dad s mother Ugh i cnt stand her bhut God bless her soul LONG LIFE STORY haha,0
What website do you spend the most time on Oh good 1 Twitter ofcousre i love me some twitter peeps They tha shit lol,0
What would be the best workplace perk Idk wait WHaaaa lol,0
What would your perfect day look like Me amp God eatin Chicken wings on His throne 3 ahaha,0
What   s one food you   ll never eat again Brussel srouts YuCkIE bhut i love cabbage and they re mini cabbages LMAO,0
What   s one thing you own that you should probably throw away but never will My old school shit i wud SOOO throw it away bhut my mom Urgh,0
What   s the best gift you   ve ever given The important 1 is Love bhut ive given people themselves Like i let my friends have themselves instead of me It helps to see who they are as a person Very important Viseversa,0
What   s the best place near you to get a drink Hahaha Wait wht kind of drink LOL well JackInTheBox is like not evn a mile away frmh my house So there i guess thts wht ur askin lmao XP,0
What   s the best place near you to get some ice cream Hmmm U makin me hungry first of all amp amp Dairy Queen YUMM,0
What   s the best place near you to get some ice cream Umm Diary Queen or JackINTHEBOX 4 my smoothies of course not ice cream Mwah,0
What   s the furthest you   ve ever traveled Virginia,0
What   s the longest you   ve ever gone without a bath or shower Haha Maybe 2days lol idk,0
What   s the most delicious meal you   ve ever had Wow this is a hard 1 i dnt think ive had 1 or i have many I love my smoothies tho YUMMIE,0
What   s the origin of your name Idk its a month that 4 sure lol,0
What   s the weirdest thing you   ve ever eaten A piece of grass,0
What   s the weirdest thing you   ve ever eaten I Havent Gotten 2 that part haha,0
what   s your best achievement Wow awesome question I think my best achievement would be quot Finding who i am quot thats thee most important 33,0
What   s your biggest phobia ummmm messy rooms,0
What   s your dream car Something cute and ME haha you kno well a beamer is my dream car basically or a porshe,0
What   s your earliest memory Haha Staring at my doctor thru sunglasses while he was in my mouth HAHAHA,0
what   s your fave song My fav song girly is umm Up amp Running by jessicajarrell atm But i have lots hbu,0
What   s your favorite drink Mmm ROOT BEER haha my fav drink eva POW,0
What   s your favorite food Actually its cabbage D,0
What   s your favorite genre of music POP,0
What   s your favorite movie quote Crap this is hard haha umm quot People Need Inspiration quot The Last Song 33,0
What   s your favorite type of flower Pink Roses,0
what   s your favourite colour Pink amp Neon green,0
what   s your favourite movie Umm A walk to remember or The Last song Ugh theirs ALOT haha hbu,0
What   s yur fav color PINK amp NEON GREEN Yeahh buddie,0
whats ur fav tv showww D Umm good question i have many bhut i guess 16 and pregnant would be 1 of my fav ones atm D,0
when ever you go to google translate DONT USE IT trust me Hahaha wht are u tlkn bout girl,0
When was the last time you gave flowers Never,0
When you were a kid what did you want to be when you grew up Actually i was that kid who wanted to be by herself so i guess when i grow up im going to be ME lol Hard question 2 answer,0
Where are ya From U S A Known as Mars 3,0
Where would you like to spend your retirement Haha when i turn 60 ish ask me this lol,0
where would you most like to live Los Angeles 33,0
where   s your ideal holiday destination Umm Dallas Texas haha Idk im so plain so idk Mwhaha,0
Who and when was your first kiss Umm Long time ago bhut i was like 5 or 6 haha Cory,0
who are your top three celebrity crushes Yumm Justin Bieber P diddys son JDoir YUMMM haha not really a celeb bhut yeah amp amp Channing Fckn TATUM haha Oh damn,0
Who are your Twitter besties Ohh mann this is a GREAT Chrissy Michelle Savannah AJ Bianca and lotss more you 33,0
Who do you think should be the next president of the United States Umm Barack Obama 4 another 4 years iLovehim,0
Who was the best teacher you   ve ever had Mmmh My second grade teach Mrs Caldwell 3,0
Who   s the funniest person you know Prob me or my seester robbie hahaha makes me wanna shit myself EVERYTIME she speaks lol,0
Who   s the most famous person you   ve met Urgh no1 yet Keep hopin though,0
Who   s the most overrated athlete Michael Jackson haha wait wrong one Michael Jordon i meant ahah,0
who   s the prettiest person you know idkk mwauuuhhh,0
Who   s the sexiest woman alive I do not judge gyrls im not bi or a lezzboo K thanks,0
Who   s the smartest person you know JustinBSource 4 sure LMAO,0
Why do u like lil kids like Justin Beiber Umm he has a bigga heart than you will EVER have so before you start to hate on a 16yr old that you obviously are addicted to get your facts straight kay,0
Why do u like that beiber kid so much He   s lame and can   t sing Umm u kno wht WTF ever STOP HATIN,0
woaahhhhhh Likee dude i   m in youhr backround D AWESOMEEEE Marryyyyy LOL itss yuhh boo Hahaha Noo durr suckkaaa Nahhh i loveee yuhhhh mooOee,0
would u ever go bungee jumping like justin did Hahaha i think i would I always do thee same shizz all thee tyme so yes i would hbu D,0
Would you rather be a famous musician or a famous actor Not a guy haha maybe a cheerleader haha jkjk,0
Would you rather be a vampire or a werewolf Werewolf AkA Jacob s Pride lol His good part lol,0
Would you rather be a zombie or a mummy Zombie 4sho,0
Would you rather be rich or famous Famous Bhut im ME 4 rite now,0
Would you rather date a lot of different people or be in a committed relationship Both LOL jk,0
Would you rather get up early or sleep late SLEEP LATE Duh,0
Would you rather own a luxury yacht or a private jet JET Hate boats Worst experience ever was on a boat Never again,0
Would you rather swim in a pool or the ocean Pool,0
Would you rather work at a large company or a small one None haha,0
yea it   s different from warm cali but   s cool D weeeell gtg now gonna meet some friends i a few minutes lol bye xx Ohh man i bet its tha shit Ohhkayy be safe have fun 33,0
yeh you r right how should the 1 be i have no bf too Yehh hahaha idk its weird Boys r Boys So Im Me alone hahah,0
Yooooo mate RinnaLovesJB here heyhey ask me anything Hahaha ight,0
you need or should delete that 911 tweet Not funny at all you know how many people died that day including my father and brother Umm im truly sorry bhut i didnt mean it in ANYWAY like u obviously got offended by and i said it wasnt funny So before you get all angry nd shit ill delete that tweet Kthanks btw RIP ur daddy and brother,0
your attitude is so fun Thank yuh soo muchh D Im likin yurs 2 Mwah,0
D nada ummm what u didnt know jose was my first kiss,0
O lol no freaking way btw i didnt ask that D no freaking way what,0
ahhh true true plus it plays music XD Exactly,0
If you had to give up one favorite food what would the most difficult Ahh Probably Cookies D,0
Pshhh liar haha im not a liar,0
What did you eat for breakfast today Cereal,0
What do you think is your most attractive feature Ewwiee Nothing haha,0
what is one thing you can   t live without its me right Hahaha of c,0
What is your biggest accomplishment Ummm probably playing softball for 10 years,0
What was your favorite birthday gift a neckalce given to me by my love 3333,0
What   s the best place near you to get a drink Starbuckks,0
What   s your favourite part to watch in Rent hmmmm think the part where te guy at support sings tht part makes me tear up La ve boheme is a good one two,0
Where   d you find out about formspring me Umm Bunch of people just joined and i got bored so i wanted too,0
who was ur first kiss umm haha i dont know why you want to kn,0
Why u so perfect hahaha im the farthest from,0
Are you wearing the p I m not wearing,0
Do you have a boyfriend yess,0
can you come to my party tonightt who iss thiiis,0
damn i hate shiiiit talkers on formspringgg i thought it was just a random question site thing ahaha thankss kidd ndd yeah i knoo reallyy huh theeree soo stupidd there to scaredd to sayy anythingg too myy face,0
i heart ahahah ii loveeee yuuuu moreee,0
i lovee joiee ii lovee yuuu moree P,0
i wub you Joie ahaha hii ceara,0
is jon the person u like noo itss nottt,0
Joie is beautifulllll aww thankss yuu aree to,0
Joiieeeee I LaLaLovee Youu ahaha,0
piratee   s or ninja   s Ahah pirateesss,0
really travis watt yuu meann,0
uhm i think i love me some freaking joie thasss right ahahah ndd ii lovee mee alott off myy lil floricell 33,0
What do you think is your most attractive feature uhmmm,0
What   s your favorite drink lemenadeee,0
Who do you like ummm ahhh hottt seniorrr,0
Who is ur lover welll forr righhtt noww no onee iss,0
Who   s the most talented person you know uhm,0
why do u try so damn hard to fit in just be your fucking self if you know how ahahah funny,0
you a sexxyy mommma Ahaha thanks,0
your such a slut vvv umm okkkayy thankss,0
sure you do liar,0
Stop hating on my page kthx why would i wanna hate on you,0
,0
girls Can you belly dance r guys can you break dance haha no,0
D,0
484 264 3364 you should call me okay,0
are you fake No are you,0
are you famous or something i haven   t heard of you x Nopee,0
are you fat nope,0
Are You Good At Hangman I Suck At It no,0
are you mental she made a proof video you cant lie are you,0
Are you ready to start school I am yea,0
are you single yea,0
ashlee cyrus florida Hey im ashlee im tired of everyone commenting on my damn formspring talking shit okay,0
ashlee i   ve had the biggest crush on you for awhile i don   t go on here a lot but please message me on www findersingle com under the username quot wishfulthinker quot please don   t get all weird NO NO,0
Ask me anythInclude Your User Info ing who are u,0
Basicc Information Name Age Location Grade ashlee 13 florida 7th,0
best lil wayne song umm idk,0
Best thing that happened to you this summer nothing really,0
bob pepe,0
but your fake I m not fake,0
Call me tomorrow at 7 00 AM OK,0
Chicken Or Hamburgers chicken 3333,0
cuter me,0
cyrus stalker,0
do i know you Do I know you,0
Do words really hurt you no,0
do you curse yea,0
Do you hate when people give short boring answers to your questions yea all the time,0
Do you know anyone who will do almost anything for attention yea my sister,0
do you like adtf yea,0
do you like bodtf yea,0
do you like nevershoutnever kinda,0
Do you like to clean yea i don t like it when it s dirty,0
Do you like your name yea,0
Do you love Twilight as much as this I bet this will be your new homepage http MyTwilightSearch com ew i hate twilight,0
Do you miss your hometown lol no,0
do you think you could make it in the woods with just camping supplys for a week no cellphone hell no,0
Does it bother you when strangers try to tell you what to do yea,0
does your bedroom door have a lock on it no,0
Don   t You Hate How People Make Fake Celerbity Pages yea that is sooo annoying,0
dont you hate it when people are only dating for about 2 days and they put quot i love the persons name quot on there statuses and stuff I do i hate that so much,0
dude ewwwwr go home roger back at you,0
Dude she   s faking herself no one else in the world would fake her No im not,0
Ever been in a gang O no,0
ever dyed your hair if so how many times never,0
fake I m not fake,0
Faveee Timee Sport volleyball,0
favorite band hm i don t have one,0
favorite color purple,0
favorite song hmm probably Alejandro by lady gaga,0
favorite song I already answered that,0
Favve Song alejandro by lady gaga,0
get naked Ew no,0
GIRLS Do Have you cheered GUYS Do Have you played football nope,0
GIRLS Have You Ever Faught Over A Guy What Happened GUYS Has A Girl Ever Faugh Over You What Happened nooo,0
GUYS What do you hate most about girls GIRLS What do you hate most about guys they can be annoying,0
Have you ever been to Georgia no but i wanna go their,0
Have you ever hated that you loved someone not really,0
Have you ever went to someones page amp seen them asking theirselves questions But when you ask them about it they deny it I   ve seen it yea that is sooo stupid,0
hello hey,0
here   s a cookie eat it D Yay nom nom,0
Hey it   s your cousin again When are you coming to visit us I   m gonna make a formspring idk,0
Hey im ashlee im tired of everyone commenting on my damn formspring talking shit,0
hi Hey,0
hi hey,0
Hmm What Questionss Inbox Me Some Ideas sure,0
how are you Great you,0
how is your mom great yours,0
How Many Siblings Do You Have 1,0
How many silly bands do you own none,0
how often do you go to the salon and get something done to your hair like twice a month,0
How old are you does it matter,0
http files formspring me profile 20100511 4bea173ca6455 thumb jpg stalkerrrr,0
i found you on jensens thingie i cant really see your picture but i guess your cute on what thanks,0
I Hate When Formspring Messes Up Don   t You sometimes,0
i hate when people are mad at for no reason at all what about you i dislike that,0
I know they   re amazing The singer Jeremy McKinnon is soooooo funny He loved giving me high fives My shirt is so cool too It   s with a fat guy on it lol Do you know the band August Burns Red dude like i said your so lucky no,0
i like yur bg thanks,0
I LOVE ADTR VvV They   re my fav I know every song by heart serious they are a good band D,0
I really wanna take you downn It   s a song lmfaoo lmfao i thought something else,0
If you had to perform at the circus what trick would you do idk,0
im bored same here,0
Is There Anyone You Wish You Never Met no,0
It   s your cousin again lol why is everyone saying your fake they are stupid,0
its cool how you swear when your only 13 i know,0
lala lololol,0
lyrics for You Should Have Killed Me When You Had The Chance ADTR So I say goodbye to a town that has ears and eyes I can hear you whispering as I walk by Familiar faces smiling back at me and I knew This would make them change The only thing that s going to bother me Is that you ll all call yourselves my friends Why can t you look me in the eyes one last time The writings on the wall you ve read that I ll be gone but if you call my name Just know that I ll come running for one more night to spare with you This is where I m meant to be please don t leave me Iu2019ve read these stories a thousand times and now Iu2019ll rewrite them all Youu2019re meddling in an anger you canu2019t control She means the world to me so hold your serpent tongue Is a whores lies worth dying for I ll just take my time The only thing that s going to bother me Is that you ll all call yourselves my friends Why can t you look me in the eyes one last time The writings on the wall you ve read that I ll be gone but if you call my name Just know that I ll come running for one more night to spare with you This is where I m meant to be please don t leave me I walked into your house this morning I brought the gun from our end table Your blood was strewn across the walls They ll find you on your bathroom floor I walked into your house this morning I brought the gun from our end table Your blood was strewn across the walls They ll find you on your bathroom floor when I m done But should I write it all off But should I write it all off But should I write it all off You should have killed me when you had the chance But should I You should have killed me when you had the chance You should have killed me when you had the chance You should have killed me when you had the chance,0
nom nom yum yum,0
obese not close to obese,0
Oh well I met ABR too The singer is the shit he   s a beast lucky pringle pop,0
online p,0
pretty gurrrl haha thanks,0
relation to Miley Cyrus what,0
Sooo you have sex alot df no,0
sure but you must spamr http www formspring me ddox3r amp r http www formspring me juliex2r or we wont continue spamming your okay sure will,0
Thats all i can think of right now sure will,0
ur pretty screw every one below me P thanks,0
Well don   t because it   s crude crude,0
What are your plans for the weekend I   m going to Miami going to my grandma s,0
What Color Are Your Eyes brown,0
What Did You For Lunch a peanut butter and jelly sandwhich,0
What did you think about before bed last night about sheep,0
what do you like best about formspring when people ask you questions,0
what does lol mean laugh out loud,0
What the hell back to you,0
What website do you spend the most time on Myspace,0
What   s the nicest thing someone   s ever done for you they made me shit 0,0
What   s the quickest you   ve fell for someone like 3 months,0
What   s your favv waterpark to go to don t have one,0
whats the last thing you do before going to bed brush my teeth,0
whats the wierdest color you   d ever dye your hair i have never dyed my hair,0
whats ur myspace page I don t have one anymore i deleted it,0
whats your favorite silly band shape a dino,0
When does school start for you Mine starts Aug 19th quot september 7th,0
When you drop your phone Do you get scared it broke I do yea,0
Where Were You Born Did You Also Grow Up There florida and yea,0
Who pays your phone bill my mum,0
Why do girls call themselves quot 5 star chicks quot Butt they still live at home with their mom lmfao,0
why do you do this to ashlee I am Ashlee duh,0
why do you fake yurself i don t fake myself,0
why do you have so many friggin formsprings geez those are fakes,0
worst place to eat at mcdonald s,0
Would you have sex with a fat guy No,0
Would you kiss the last person you talked to on the phone ew no,0
would you rather your parents watch you having sex or your preacher from beginning to end lmao parents xD,0
wow woah,0
xdfcvghjkl dsfdsfdsgfdfgsd,0
Yeah I met them at their show Got a free shirt too serious your so lucky,0
Yeauh I   m Really A liar You   re Cool r i don   t lie for stupid reasons okay o,0
you drunk nah,0
you got a myspace yea,0
You guys have funny answers Do you read peoples answers to your questions like i do D yea lol all the time,0
YOU NEVER CALLED ME my bad,0
you should come next week k,0
You should ignore all those comments people send to you Everyone knows you don   t fake yourself and they just want to be like you You   re very pretty and I know I   m jealous of my cousin o,0
quot iloveyoubaby quot quot iloveyoutoobabygirl quot that haha x Yess it was pretty cute,0
,0
a c t u a l l y i DO want himm Goooooood cause I want you too 3,0
ahaa ge i wonder ha i likee you kidd Awww maybe you should tell me who you are so we can get to know each other KID 3,0
ahaa to late i already sent youu onee ooo i guess you re too quick for me,0
ahahaahahahaha yourr a funny kid I knowwww,0
ahh this is cutee What s cute,0
alright cool,0
and why is that I forgot what we were talking about p I love you twinsie 3,0
And why would you fight for her jst asken Because she is an amazing person and I hope that she would agree with me when i say we re quot close friends quot,0
anyone or someone particular Kinda but idk if she s still feelin it,0
are u guus foing out yet Yes we are,0
are you and lindsey talking As friends but nothing more than that she doesn t like me like that,0
are you foing out nah bro not yet hopefully soon though,0
Are you saying you would fight for lindsey because a lot of people would Your not the first quot challenge quot I m not trying to be the challenge Ithought you were but seeing as you re not then there s no point in arguing And yes i would fight for Lindsey anytime anywhere,0
arent u guys going out nah buddy so who are you,0
because if its who i think it is i asked if she wants a boyfriend and you can find out the rest from her if it is her Who do you think it is,0
bullllllllll ahah I swear I could never lie to my fiancee,0
but it says right above that i cant That s sarcasm its why i put a winky face,0
Cute Thanksss who is this D,0
