Might have busted my hand but its Gucci,1
Gucci We dont know her,1
When you ask her to Gucci your flops and she says yes,1
Whats Gucci my Louie,1
Gucci Free i know,1
you cant hurt me my shades are gucci ,1
going to therapy tomorrow expect some gucci tweets afterwards,1
the Gucci king is back at it again,1
Okay its official now just need passport to arrive and we gucci ,1
me my hair and gucci ,1
I made Sonic gucci again,1
Words cant hurt me these shades are gucci ,1
You cant hurt me these shades are Gucci thinking abt buying something gucci wearing ,1
this kinda looked gucci to me so i did some research and found out that its actually from an online store called classy vision ,1
I broke out the blazer today whats gucci ,1
White diamonds on my wrist Bitch its Gucci Gang,1
i look trashy but its gucci Taes smile makes up for it,1
My MCM hasnt really fucking changed sooo look at this Gucci Boi ,1
words cant hurt me these shades are gucci ,1
ok flex ur gucci all u want i wouldnt mind,1
They be like Im Gucci but dont shop there,1
may not look it but I promise Im all gucci,1
Gucci morning,1
The darkness cant hurt me these shades are gucci,1
Finna smell nice always Gucci guilty got me,1
Im gucci ,1
Sorry Im a girl is clean right now waiting for my monitor then We Gucci ,1
Durag style but Gucci way,1
Theres Gucci in my stride and money on my mind but this time the prize is just me myself and I,1
Chan whats Gucci,1
its all gucci i found them ,1
I cant front Im shook of atl box I cant double bacc on none of my ATL jawns Im Gucci,1
Im not boycotting sh Its Gucci over here How about we stop killing us,1
As long as my kids love me Im GUCCI,1
We gon suffer but we gon suffer together so its all gucci,1
My favorite fruit used to be too Gucci for all of us,1
All that Louis wont make life Gucci,1
my phone will be on dnd all weekend dont text me im good im gucci,1
look at Gucci being all gucci ,1
Stop with the alberts stuff man,1
nibber im broke asf,1
did you just call me nibber,1
I dont even know what a nibber is ,1
SINCE WHEN CANT YOU SAY NIBBER ON STREAM,1
As long as the profs are woke we shouldnt change a thing,1
And good for you for realizing that woke,1
professor men me professor and women  me now thats woke,1
Some of these woke people out here are asleep and dreaming that theyre awake Fighting unconsciousness with unconsciousness,1
The fluoride in the water calcifies the Pineal Gland and prevents you from transcending into the astral plane woke,1
When I said Hey Boo today I started balling my eyes out of gratitude and realizing all those false accusations everyone made about Boo was Cr Courage WOKE,1
They keep going after Alfz and then think Captain Carl Manvers was review bombed by bots BelieversofMedia Woke,1
Its official Im looking into it EddieBravo FlatEarth Woke,1
What is the next stage of human evolution Spiritual or technological At this rate will we even make it woke WokeAF QuestionOfTheDay Questiontime Spirituality thirdeye evolution needtoknow questionsforsatan,1
So woke The left really has their fingers on the pulse of the country,1
Realization at 5 AM If by uncle she means Isshinthen could it be that Kukaku isICHIGOS COUSIN WOKE,1
They get grants we pay those grants in taxes Then they donate to a political campaignwe are paying for their donation They get the tax credit for the donation Thank you FB GOOGLE AMAZON TWITTER APPLE BIG TECH LIES  SPIES,1
Google ousted the photo of antifa beating that old man in the wheel chair This one will have to do them sporting the American shame burka for when your actions are so humiliating that you must cover your face It goes hand in hand with the avoidance of responsibility woke,1
I am woke AF Its 544 now,1
Wow hes really so excited about this bench designed to make sure homeless people cant sleep on them woke,1
Truth speaker rogan woke,1
i play on both sides woke ScorpiosBeLike ,1
People are so woke now that they sometimes forget to wake up from dreamingbecause real life isnt just flowers and happy babies woke WokeAF FacebookDown,1
Be woke but still be enjoyable to be around Woke gaytwitter pictwittercom5UUcTjJBEd,1
I wonder if my woke friends had any politically charged memes,1
Ah read it and weep USWNT et al Im SO looking forward to the day these athletes permeate your ranks woke,1
Rockets are down but they going to get the dub tonight over golden state Woke,1
Who dares not speak their free thoughts is a slave mentalillness menntalhealth inspire woke,1
Lol Thatd be too much like Throwing Fuel into the Tank of the Bus She Just Hijacked like a True Somali Pirate The Deep State  their Controlled Opposition are Out of Control The Kayos theySoros Hoped for Is Not Going As Planned in CHIRAQ or Elsewhere as the World is Woke now,1
Tech companies get grants grants are tax money that WE PAY CIA gives tech companies the DARPA program and billions of s to illegally spy on the citizens We are taxed by our government for them to spy on us woke,1
Dont forget to really sound enlightened by using WOKE,1
If we gonna mute MJ if we better mute steven Spielbergtyler perry david bowie prince panic at the disco and others because there are rumors about them too all because they dont a special documentary doesnt mean they didnt do horrible stuff woke muteeveryone,1
ill say this once and maybe a few other times Hyde  Carroll is our generations Lennon  McCartney newengine goodcharls johnlennon PaulMcCartney thebeatles woke,1
Wow Well done Thanks for keeping us woke,1
Yoga people are woke but still refer to their eye opening trip to Mt Kilimanjaro as Africa,1
AnisQiz Beware of you selftalk woke,1
Theyre just woke,1
Wasnt into politics didnt even vote when BarackObama was in office But yall president realDonaldTrump got me woke 2020Election Im voting AndrewYNg,1
possibly the most wokefairenough birthday Google will celebrate this year,1
MLK MalcolmX reparations 30 Trillion might do it We need a plan ADOS is  Stop complaining about word choice in ADOS You woke fools We have to fix ourselves first,1
Not to mention DenverAirport and FalseFlag HenHouseBrewing is woke,1
I watched CaptainMarvel today so yeah I guess you could say Im pretty woke,1
We love our uni for being so woke when it comes to sustainability Lets ensure this good behaviour continues at home come along to our Recycling in Colchester talk and become a recycling pro We will be waiting for you with smiles and biscuits  When 45pm in NTC307,1
My new favorite beer is woke Id like to share ones with my friends,1
Just got my birdsarentreal shirt Time to spread the feathered gospel,1
Scorbunny thinks maybe they misstyped her Rabbit BunnyPink Underwear Pokemon THOT 8gen,1
It should be illegal to be a thot thot,1
The Yellow kitsune I felt like drawing Renamon looking all mystical and fantastical Digimon renamon thicc furry thot,1
Looking like a THOT for art fest today,1
TheWholePackage Your Next guilty TV pleasure on OUTtvpartnered with DirtSquirrelCo dirtysquirrelco outtvaveragejoe gaytv gaymen gaymodels homoculturehttpowly8TRy30nY02o  ThirstyThursdays thot HotOrNot,1
Now Available Former White House Press Secretary Joe Lockhart joelockhart katieleebarlow CNN WordsMatter,1
Finally did right by that fashion nova bag cub bear baramusclebear thot fashionnova bodypositive chestday fitnesspictwittercomRkuji6B159,1
Buy me stuff it makes me happy httpamzneu4xYbXTp trans gothgirl gothtrap mtf model cosplay transgendertrap tgirl emofringe sissy femout hentaithisiswhattranslookslike transwoman transgirl slut thotthicc traps makeup follow tweegram followmepictwittercomLTs1ghnj1I,1
I love this outfit so much Lets get retweeted D trans gothgirlgothtrap mtf TransIsBeautiful transgender trap tgirlemofringe tranny sissy femout mtfthisiswhattranslookslike transwoman transgirl slut thotthicc traps trap pictwittercomDMV653KCwK,1
Fashion Show from my dirty house sorry to brag Im just so full of myself Thot,1
LUV AND SUPPORT THOT,1
So I was walking around a port in Singapore and precious thotautocorrect port singapore holiday language funnytoomanyhashtags,1
happy birthday to my twin my sister my best friend i luv u so much twerk tayo ng todo later ha LiliKarma THOTTeamNaomiSmalls paulxsese,1
Are you ready for Valentines Day Its kinda my favorite holiday,1
Hey in there Happy reacts and retweets only trans gothgirlgothtrap mtf TransIsBeautiful transgender trap tgirlemofringe sissy femout thisiswhattranslooksliketranswoman transgirl slut thot thicc traps makeupfollow tweegram pictwittercomNkASAuWixI,1
SilverIP provides gigabit Internet and concierge support to multifamily buildings and businesses in Chicago Wed love for you to join us,1
TONIGHT We tear up theironroadrock with deadmanswhiskey WesternSandUK and SKAMUK and we cant fuking wait Join us from 7pm and lets Rock rocknrollthehotonetwo THOT SupportNewMusic supportlocalmusiclivemusic NWOCR ROCKMUSIC,1
Its Wednesday Some hate the midweek but it makes me happy trans gothgirl gothtrap mtf TransIsBeautiful transgendertrap tgirl emofringe tranny sissy femout goth emothisiswhattranslookslike transwoman transgirl slut thotthicc traps trap pictwittercomfWbADja2F2,1
Ive never felt so seen gutterslut thot sexpositive kink mess,1
Could it be BAE Systems  other UK contractors have bigger sway in UK politics than US contractors on theirs,1
Drew this pic of me and bae yesterday Im on the right she on the left You could say its serious,1
Its why the CVRFDR was sent to BAE in Paris Ethiopia denied the NTSB access to the Recorders You can thank Spanky Elaine  the FAA for that,1
Bruhhh Im so vex security and the show was a shambles and they wanna blame bae,1
Bae asleep so I guess I can get dressed for the day,1
Proud of you bae,1
When youre trying to figure out why bae is cranky,1
When get off the phone from arguing with bae and realize you dont have anyone else to talk to,1
matching icons for you and your kickass bae,1
DeadSoul0 oh bae Youre alive  waooowwwww,1
This girl posted on her IG story wearing baes shoes 5 hours later she went like single HMU  Wtf,1
Throwback to this once upon a time most visited restaurant Mr Biggs,1
Mr Biggs doughnut was and is still bae ,1
suede wants a bae but a bae dont want suede,1
Wild Irish Roses amp Edgar Allen Poed Up Forever In the Rotation  Love You Bae ,1
DEEPIKA IS ON VOGUE COVER WITH SCARLETT JOHANSSON AND BAE DOONA OMFG IS THIS FOR REAL  httpstco0Kbp7YV09h,1
a fan screamed bae jinyoungyou are the most handsome in uniqlo and look at jinyoungs reaction omg that expression so cu,1
The Salt Bae of the dairy industry httpstcoonaUjpdk2N,1
Youre my Bae Bae ,1
bigfreedia tell bae that I miss her since market days,1
Wanna take a baecation to Orlando but I have no bae ,1
Just bought Bae and I matching Ralph Lauren Hoodies ,1
You should be dear bae  httpstco8GsZACeW1G,1
Im happy for you bae ,1
When I try to look sexy for bae  httpstco9c27IyoKQj,1
When bae likes another girls picture httpstcoBZ6azIgcWQ,1
ON GOD BAE OR NAH THEY DID THIS  httpstcoT0nJG9FQ7J,1
When you want to take cute pictures but Bae just want to eat  httpstcogJ7RLD74eP,1
When I thought we was just gone fuck but we made love now he bae  httpstcoBJZo1NgnLh,1
EbeMonateRelationship and you start practicing signing your signature using bae s Surname httpstcoyImqlktrIW,1
Thats my bae Danai over him though thus my angry tweets ,1
Total be 8761 yo girl be like Hold on I got the 61 cents right here bae ,1
I need to hurry up and get married Im looking forward to not cleaning lol Bae already told me she enjoys doing it and I dont have to,1
Whoever keeps bailing R Kelly out please pay off my student loans I dont owe anything near 100k Please bae and thank you,1
Drew this pic of me and bae yesterday Im on the right she on the left You could say its serious httpstcoDMzqu5zSvP,1
alysseimpretty Happy Birthday Bae ,1
Thank you bae   httpstcoT8WVWytjec,1
No makeup on the road with bae httpstcovhL2YNec1j,1
New US citizen My bae httpstcoFjDU3tixTR,1
he said I dont want no Dairy Queens bae but guess where we going ,1
Yall loveeeee hatin on a mf for being with their significant otherboobae etc majority of the time because youre LONELY bu,1
This is me When bae ignor me  httpstcoRMkGQDImq6,1
Hes bae And so is Daenerys,1
On the male side perhaps but the female side was a little meh Captain Marvel is my bae ,1
thank u bae and wish  httpstcoMvofQ71hFi,1
Im looking so rough but me and Bae Ling trying out cream of ice,1
ready for me and bae to be living our best lives taking trips around the world amp shit,1
now this whole momo shit up there buggin out and kids verbal filters becoming thinner and thinner each video,1
Stevan Youve heard of momo but have you heard of hehe Me Who tf is that Stevan Michael Jackson,1
Excuse my language but how fucking fucked up must the person behind this momo challenge be to scare kids into suicide  self harm Fucking disgusting,1
all sorts of things live thereIm sure Momo is among them,1
Momo this is just a broccoli,1
There are six 58 year olds on my bus right now and they have been talking about Momo for fifteen minutes We just drove by a jail and one of them asked Mommy do you think Momo is in that jail,1
Hello its momo fucking ran down the stairs as fast as I could,1
Also Appa  Momo should be the Duck Hunt Duo of this game,1
fuck i was SO close to beating yukis secret but kohaku and momo died ,1
That was between you me and Marie Youre taking it out on the rest of Twitter by subjecting it to the horrors of Momo Leave that to Facebook,1
mina and sana in the car when momo comes to pick them upsana why is hirai momo driving us to school,1
hey im right here i know sana uh well im her girlfriend sana making a panicked noise,1
momo got mad and broke it,1
idk whybut can we have yuta yuto hina momo sana  nako interaction pls they all would look cute together,1
Momo is great and I love her and Ive loved every moment centered around her and shes by far my favorite student and I understand the logistics of having her outfit be like that but also like Why,1
Finally I manage to size in properly on sympathy momo traded ATOS Premarket and BOXL OXBR in the open 2135 on ATOS BOXL OXBR,1
Momo instagram is too funny,1
I am more short term in any OTC stock as they are all scams I just play the charts SS L2 and momo,1
Momo jaan I want to tweet about you but I m suffering from  March mania  weekend tak wait karo,1
MOMO IS MY FAV ONE BY FAAAR HAHAHA,1
Back in the early 70s there were sightings of a sasquatch creature in Missouri that earned the moniker MOMO Missouri Monster It scared small children as far away as Illinois,1
What is a momo video,1
